[
  {
    "candidate_count": 1,
    "candidates": [
      {
        "lat": 31.4653,
        "lon": 30.3667,
        "lonlat_type": "representative point",
        "modern_id": "m91acfa",
        "name": "Nile River",
        "precision_meters": 100,
        "probability": 1.0,
        "score": 1000
      }
    ],
    "chapters": [
      7
    ],
    "dispersion_index": 0.0,
    "is_locatable": true,
    "mention_count": 1,
    "name": "Nile",
    "place_id": "a012705",
    "slug": "nile",
    "sources": [],
    "special_reason": null,
    "type": "river",
    "verses": [
      "44007019"
    ]
  },
  {
    "candidate_count": 1,
    "candidates": [
      {
        "lat": 31.76841,
        "lon": 35.23288,
        "lonlat_type": "point",
        "modern_id": "m0b0e06",
        "name": "Akeldama",
        "precision_meters": 20,
        "probability": 1.0,
        "score": 456
      }
    ],
    "chapters": [
      1
    ],
    "dispersion_index": 0.0,
    "is_locatable": true,
    "mention_count": 1,
    "name": "Akeldama",
    "place_id": "a040ba5",
    "slug": "akeldama",
    "sources": [
      {
        "citation": "Eerdmans Dictionary of the Bible (2000)",
        "locator": "Akeldama",
        "source_id": "s0dea33"
      },
      {
        "citation": "Holman Illustrated Bible Dictionary (2003)",
        "locator": null,
        "source_id": "s284e5a"
      },
      {
        "citation": "Baker Illustrated Bible Dictionary (2013)",
        "locator": "Akeldama",
        "source_id": "s29dcd8"
      },
      {
        "citation": "Anchor Yale Bible Dictionary (1992)",
        "locator": "Akeldama (place)",
        "source_id": "s3f220c"
      },
      {
        "citation": "Archaeological Encyclopedia of the Holy Land (1990)",
        "locator": "Field of Blood; Aceldama",
        "source_id": "s435156"
      },
      {
        "citation": "Zondervan Illustrated Bible Backgrounds Commentary (2009)",
        "locator": "Matt 27:7-8; Acts 1:19",
        "source_id": "s46f23a"
      },
      {
        "citation": "Nelson’s Illustrated Bible Dictionary (2014)",
        "locator": "Akeldama",
        "source_id": "s559561"
      },
      {
        "citation": "Zondervan Encyclopedia of the Bible (2010)",
        "locator": null,
        "source_id": "s565ee7"
      },
      {
        "citation": "OpenBible.info (2021)",
        "locator": null,
        "source_id": "s6cb875"
      },
      {
        "citation": "New Unger’s Bible Dictionary (1988)",
        "locator": null,
        "source_id": "s6ce624"
      },
      {
        "citation": "Wycliffe Bible Encyclopedia (1975)",
        "locator": "Aceldama",
        "source_id": "s73c38d"
      },
      {
        "citation": "International Standard Bible Encyclopedia (1979)",
        "locator": "Akeldama",
        "source_id": "s876c69"
      },
      {
        "citation": "Tyndale Bible Dictionary (2001)",
        "locator": "Akeldama",
        "source_id": "s93d4c1"
      },
      {
        "citation": "Zondervan Atlas of the Bible (2010)",
        "locator": null,
        "source_id": "s9bf83d"
      },
      {
        "citation": "Baker Encyclopedia of Bible Places (1995)",
        "locator": null,
        "source_id": "sad8eb0"
      },
      {
        "citation": "New Interpreter’s Bible Dictionary (2009)",
        "locator": null,
        "source_id": "se72732"
      },
      {
        "citation": "New Bible Dictionary (1996)",
        "locator": "Akeldama",
        "source_id": "sea6c3d"
      },
      {
        "citation": "Grollenberg, Atlas of the Bible (1957)",
        "locator": "Akeldama",
        "source_id": "sfd1514"
      }
    ],
    "special_reason": null,
    "type": "field",
    "verses": [
      "44001019"
    ]
  },
  {
    "candidate_count": 1,
    "candidates": [
      {
        "lat": 39.490556,
        "lon": 26.336667,
        "lonlat_type": "point",
        "modern_id": "mce3faf",
        "name": "Assos",
        "precision_meters": 5,
        "probability": 1.0,
        "score": 1000
      }
    ],
    "chapters": [
      20
    ],
    "dispersion_index": 0.0,
    "is_locatable": true,
    "mention_count": 2,
    "name": "Assos",
    "place_id": "a0a2ca7",
    "slug": "assos",
    "sources": [],
    "special_reason": null,
    "type": "settlement",
    "verses": [
      "44020013",
      "44020014"
    ]
  },
  {
    "candidate_count": 1,
    "candidates": [
      {
        "lat": 39.266667,
        "lon": 32.983333,
        "lonlat_type": "representative point",
        "modern_id": "m7e7545",
        "name": "Galatia",
        "precision_meters": null,
        "probability": 1.0,
        "score": 1000
      }
    ],
    "chapters": [
      16,
      18
    ],
    "dispersion_index": 0.0,
    "is_locatable": true,
    "mention_count": 2,
    "name": "Galatia",
    "place_id": "a0f440a",
    "slug": "galatia",
    "sources": [
      {
        "citation": "Westminster Historical Atlas to the Bible (1956)",
        "locator": null,
        "source_id": "s092bb0"
      },
      {
        "citation": "Baker Book of Bible Charts, Maps, and Time Lines (2016)",
        "locator": null,
        "source_id": "s61f084"
      },
      {
        "citation": "Hudson, Bible Atlas and Companion (2008)",
        "locator": null,
        "source_id": "s938612"
      },
      {
        "citation": "Oxford Bible Atlas, Fourth Edition (2007)",
        "locator": null,
        "source_id": "s9703b2"
      },
      {
        "citation": "Zondervan Atlas of the Bible (2010)",
        "locator": null,
        "source_id": "s9bf83d"
      },
      {
        "citation": "Holman Bible Atlas (1999)",
        "locator": null,
        "source_id": "s9c4f74"
      },
      {
        "citation": "Barnes, Historical Atlas of the Bible (2010)",
        "locator": null,
        "source_id": "sdd21d1"
      },
      {
        "citation": "ESV Bible Atlas (2010)",
        "locator": null,
        "source_id": "sfd4d34"
      }
    ],
    "special_reason": null,
    "type": "region",
    "verses": [
      "44016006",
      "44018023"
    ]
  },
  {
    "candidate_count": 1,
    "candidates": [
      {
        "lat": 41.46639,
        "lon": 12.9975,
        "lonlat_type": "point",
        "modern_id": "m4241cc",
        "name": "Forum Appii",
        "precision_meters": 200,
        "probability": 1.0,
        "score": 1000
      }
    ],
    "chapters": [
      28
    ],
    "dispersion_index": 0.0,
    "is_locatable": true,
    "mention_count": 1,
    "name": "Forum of Appius",
    "place_id": "a121d5e",
    "slug": "forum-of-appius",
    "sources": [],
    "special_reason": null,
    "type": "settlement",
    "verses": [
      "44028015"
    ]
  },
  {
    "candidate_count": 1,
    "candidates": [
      {
        "lat": 31.776667,
        "lon": 35.234167,
        "lonlat_type": "representative point",
        "modern_id": "m66c5b8",
        "name": "Jerusalem",
        "precision_meters": 250,
        "probability": 1.0,
        "score": 1000
      }
    ],
    "chapters": [
      1,
      2,
      8,
      9,
      10,
      11,
      12,
      15,
      21,
      26,
      28
    ],
    "dispersion_index": 0.0,
    "is_locatable": true,
    "mention_count": 14,
    "name": "Judea 1",
    "place_id": "a149f13",
    "slug": "judea-1",
    "sources": [],
    "special_reason": null,
    "type": "region",
    "verses": [
      "44001008",
      "44002009",
      "44002014",
      "44008001",
      "44009031",
      "44010037",
      "44010039",
      "44011001",
      "44011029",
      "44012019",
      "44015001",
      "44021010",
      "44026020",
      "44028021"
    ]
  },
  {
    "candidate_count": 1,
    "candidates": [
      {
        "lat": 31.776667,
        "lon": 35.234167,
        "lonlat_type": "point",
        "modern_id": "m66c5b8",
        "name": "Jerusalem",
        "precision_meters": 250,
        "probability": 1.0,
        "score": 1000
      }
    ],
    "chapters": [
      1,
      2,
      4,
      5,
      6,
      8,
      9,
      10,
      11,
      12,
      13,
      15,
      16,
      18,
      19,
      20,
      21,
      22,
      23,
      24,
      25,
      26,
      28
    ],
    "dispersion_index": 0.0,
    "is_locatable": true,
    "mention_count": 70,
    "name": "Jerusalem",
    "place_id": "a15257a",
    "slug": "jerusalem",
    "sources": [],
    "special_reason": null,
    "type": "settlement",
    "verses": [
      "44001004",
      "44001008",
      "44001012",
      "44001013",
      "44001019",
      "44002005",
      "44002014",
      "44004005",
      "44004016",
      "44005016",
      "44005028",
      "44006007",
      "44008001",
      "44008014",
      "44008025",
      "44008026",
      "44008027",
      "44009002",
      "44009013",
      "44009021",
      "44009026",
      "44009028",
      "44010039",
      "44011002",
      "44011022",
      "44011027",
      "44011030",
      "44012025",
      "44013013",
      "44013027",
      "44013031",
      "44015002",
      "44015003",
      "44015004",
      "44015022",
      "44015023",
      "44015033",
      "44016004",
      "44018021",
      "44018022",
      "44019021",
      "44020016",
      "44020022",
      "44021004",
      "44021011",
      "44021012",
      "44021013",
      "44021015",
      "44021017",
      "44021018",
      "44021021",
      "44021031",
      "44022003",
      "44022005",
      "44022017",
      "44022018",
      "44023011",
      "44024011",
      "44024017",
      "44025001",
      "44025003",
      "44025007",
      "44025009",
      "44025015",
      "44025020",
      "44025024",
      "44026004",
      "44026010",
      "44026020",
      "44028017"
    ]
  },
  {
    "candidate_count": 1,
    "candidates": [
      {
        "lat": 33.270833,
        "lon": 35.196111,
        "lonlat_type": "point",
        "modern_id": "m11c602",
        "name": "Tyre",
        "precision_meters": 5,
        "probability": 1.0,